{
  "schema_version": "agent_dual_prediction_report_v1",
  "report_mode": "system_plus_llm_advisory",
  "truth_accessed": false,
  "case_id": "20180614_00",
  "region_id": "SA-04",
  "hazard": "heatwave",
  "dataset_split": "development",
  "focus_lead_time_hours": 48,
  "selected_joint_rule": "joint_heat_pooled_median_loco_kg_temporal_or_spatial_margin1p0_windows3_maxmargin0p0",
  "development_gate_passed": false,
  "operating_status": "research_only_blocked",
  "formal_warning_allowed": false,
  "system_focus_risk_level": "low",
  "llm_focus_advisory_risk_level": "medium",
  "llm_focus_confidence": "medium",
  "focus_agreement": false,
  "system_analysis_zh": "系统联合预测（锁定保留）：24小时base=low、joint_final=low、knowledge_triggered=false；48小时base=low、joint_final=low、knowledge_triggered=false；72小时base=low、joint_final=low、knowledge_triggered=false。系统采用pooled_median_loco，知识模式为temporal_or_spatial；对应候选Tmax分别为47.131059°C、47.247716°C、46.003146°C，热日阈值为47.249969°C。",
  "llm_advisory_summary_zh": "LLM独立综合预测意见：24/48/72小时均评估为medium。24小时空间高温已较突出；48小时局地最高温仍接近24小时水平且高空暖脊信号增强；72小时日最高温回落，但较高夜温、增强的低层风与水汽输送使热压力不宜直接降为low。由于缺少持续性、暴露与预报不确定性信息，置信度均为medium。",
  "comparison_analysis_zh": "系统联合预测在24、48、72小时均为low，且知识图谱未触发；LLM独立综合意见在三个窗口均为medium，分歧来自LLM同时权衡了高分位/局地极端高温、较高夜间最低温和500 hPa高位势高度背景，而系统的候选日最高温均未达到其47.249969°C热日阈值。至72小时，最高温指标有所回落，但夜间最低温、低层风和水汽输送增强，因此LLM维持medium而未上调或下调。两者均仅为预测期研究分析，不对应任何事后结果判断。",
  "timeline_analysis": [
    {
      "lead_time_hours": 24,
      "system_base_risk_level": "low",
      "system_knowledge_triggered": false,
      "system_joint_final_risk_level": "low",
      "llm_advisory_risk_level": "medium",
      "llm_advisory_confidence": "medium",
      "agreement_with_system": false,
      "advisory_analysis_zh": "LLM独立评估为medium：区域加权Tmax为44.27°C、空间p95为45.63°C、最大值46.30°C，显示存在较高温的空间尾部；加权Tmin为29.77°C、最大值32.20°C，夜间降温有限。500 hPa加权位势高度为5874.27 gpm，提供偏暖背景支持。尽管系统候选Tmax 47.131059°C低于47.249969°C阈值且图谱未触发，LLM将局地高温与夜热综合为中等研究风险；缺少持续性和暴露资料，置信度为medium。",
      "key_signals_zh": [
        "Tmax：加权均值44.27°C、空间p95 45.63°C、最大46.30°C",
        "Tmin：加权均值29.77°C、最大32.20°C",
        "500 hPa位势高度加权均值5874.27 gpm",
        "系统候选Tmax 47.131059°C，低于热日阈值47.249969°C"
      ]
    },
    {
      "lead_time_hours": 48,
      "system_base_risk_level": "low",
      "system_knowledge_triggered": false,
      "system_joint_final_risk_level": "low",
      "llm_advisory_risk_level": "medium",
      "llm_advisory_confidence": "medium",
      "agreement_with_system": false,
      "advisory_analysis_zh": "LLM独立评估为medium：最大Tmax为46.29°C、空间p95为45.75°C，与24小时相近，局地日间高温信号延续；500 hPa加权位势高度升至5880.51 gpm。加权Tmin为29.52°C，仍提示暖夜背景。系统候选Tmax 47.247716°C几乎贴近但仍低于47.249969°C阈值，且知识图谱未触发，故系统锁定为low；LLM基于多指标综合维持medium，置信度为medium。",
      "key_signals_zh": [
        "Tmax：加权均值43.55°C、空间p95 45.75°C、最大46.29°C",
        "Tmin加权均值29.52°C，最大32.56°C",
        "500 hPa位势高度加权均值5880.51 gpm",
        "系统候选Tmax 47.247716°C，仍低于47.249969°C阈值"
      ]
    },
    {
      "lead_time_hours": 72,
      "system_base_risk_level": "low",
      "system_knowledge_triggered": false,
      "system_joint_final_risk_level": "low",
      "llm_advisory_risk_level": "medium",
      "llm_advisory_confidence": "medium",
      "agreement_with_system": false,
      "advisory_analysis_zh": "LLM独立评估为medium：日间热信号减弱，Tmax最大值44.95°C、空间p95为44.50°C，较前两窗口下降；但Tmin最大值升至33.29°C、空间p95为31.73°C，夜热尾部增强。500 hPa加权位势高度进一步升至5889.86 gpm，IVT加权均值升至142.78 kg m-1 s-1，850 hPa风速加权均值升至8.95 m s-1。最高温回落抑制上调，暖夜与背景场则不支持下调，故维持medium、置信度medium。系统候选Tmax 46.003146°C低于阈值，图谱未触发，锁定结果为low。",
      "key_signals_zh": [
        "Tmax降至加权均值42.75°C、空间p95 44.50°C、最大44.95°C",
        "Tmin最大值升至33.29°C，空间p95升至31.73°C",
        "500 hPa位势高度加权均值5889.86 gpm；IVT加权均值142.78 kg m-1 s-1",
        "系统候选Tmax 46.003146°C，低于热日阈值47.249969°C"
      ]
    }
  ],
  "uncertainty_analysis_zh": "24至48小时，局地Tmax最大值基本持平、空间p95略升，高空位势高度增强，支持热风险维持；48至72小时，日间Tmax明显下降，但夜间最低温上升、IVT和850 hPa风增强，形成相互抵消的演变信号。空间统计量提示区域内部不均匀，且未提供预报集合、持续日数、历史分位距平、暴露或健康影响资料，因此无法把中等研究风险解释为确定的高温过程或业务阈值越界。",
  "limitations_zh": [
    "该案例处于development数据集，且方法开发门槛未通过，运行状态为research_only_blocked。",
    "所有判断仅使用预测期可用指标、窗口间变化、图谱/方法信息；未访问同期观测、事件或对照标签、命中漏报误报、新闻或任何事后答案。",
    "区域加权均值、空间p95和最大值不能替代人口暴露、热健康脆弱性、持续天数、城市热岛及预报集合离散度等信息。",
    "LLM的medium意见是独立研究性风险分层，不是经校准的业务预警阈值；即使其评估为high，也不得授权正式预警。"
  ],
  "recommended_actions_zh": [
    "仅作为研究候选个案，继续监测后续预报窗口中的最高温、最低温及其空间覆盖变化。",
    "对24—48小时重点复核局地高温聚集范围和夜间最低温；对72小时重点复核最高温回落是否与夜间热压力维持并存。",
    "在获得合规的业务流程、独立验证和通过开发门槛前，不发布或授权任何正式高温预警。",
    "将系统low与LLM medium的分歧保留用于后续、与真值隔离的研究评估和方法校准。"
  ],
  "provenance_summary_zh": "系统预测锁定文件为handoff/reports/dual_prediction_batch_v1/system_prediction_locks/heatwave_development.csv，prediction-lock SHA-256为3f88b1d7afa24e2731e67f3b42a47ef546a9801e879bc53ff1057b6fe945e047；规则选择锁定文件为manifests/joint_pipeline_selection_lock_v2.json，selection-lock SHA-256为8d3526d9f6528378d274129ad424cba39904a5cfcce2e164fc62fe7b4ca55545。图谱查询模式为live_neo4j。系统结果按锁定记录保留，LLM意见另行生成。",
  "generation_mode": "openai_terra"
}
