{
  "schema_version": "agent_dual_prediction_report_v1",
  "report_mode": "system_plus_llm_advisory",
  "truth_accessed": false,
  "case_id": "20180619_00",
  "region_id": "SA-03",
  "hazard": "heatwave",
  "dataset_split": "development",
  "focus_lead_time_hours": 48,
  "selected_joint_rule": "joint_heat_pooled_median_loco_kg_temporal_or_spatial_margin1p0_windows3_maxmargin0p0",
  "development_gate_passed": false,
  "operating_status": "research_only_blocked",
  "formal_warning_allowed": false,
  "system_focus_risk_level": "low",
  "llm_focus_advisory_risk_level": "medium",
  "llm_focus_confidence": "medium",
  "focus_agreement": false,
  "system_analysis_zh": "系统锁定联合预测（不可修改）：24小时：base_risk_level=low，knowledge_triggered=false，joint_final_risk_level=low，candidate_tmax_degc=44.992221，hot_day_threshold_degc=47.0；48小时：base_risk_level=low，knowledge_triggered=false，joint_final_risk_level=low，candidate_tmax_degc=45.732241，hot_day_threshold_degc=47.0；72小时：base_risk_level=low，knowledge_triggered=true，joint_final_risk_level=medium，candidate_tmax_degc=46.326007，hot_day_threshold_degc=47.0。",
  "llm_advisory_summary_zh": "LLM独立综合预测意见为24小时low（中等置信度）、48小时medium（中等置信度）、72小时high（中等置信度）。依据是预报最高气温空间高值由44.15°C升至45.41°C、再升至47.78°C，72小时局地最高值超过47.0°C热日阈值；同时空间P95最高气温由43.53°C升至44.86°C，最低气温空间高值由34.18°C升至38.02°C，显示热风险随时间增强。",
  "comparison_analysis_zh": "系统联合预测逐字保留：24小时low、48小时low、72小时medium。LLM独立意见基于预测时可用的完整指标，判断热信号从24小时的偏暖但未接近区域阈值，发展至48小时的升温与暖夜增强，再至72小时出现局地最高tmax超过47.0°C阈值，因此给出low、medium、high。分歧集中于48和72小时：LLM对持续升温、暖夜及72小时局地极端高温更敏感；系统在48小时仍为low，且72小时仅由知识触发上调至medium。该差异仅为两套预测规则的独立输出，不涉及任何同期观测、标签或事后结果。",
  "timeline_analysis": [
    {
      "lead_time_hours": 24,
      "system_base_risk_level": "low",
      "system_knowledge_triggered": false,
      "system_joint_final_risk_level": "low",
      "llm_advisory_risk_level": "low",
      "llm_advisory_confidence": "medium",
      "agreement_with_system": true,
      "advisory_analysis_zh": "LLM独立判断为low。预测空间P95 tmax为43.53°C、最高tmax为44.15°C，尚未达到47.0°C阈值；但加权平均tmax为41.51°C、空间P95 tmin为33.54°C，表明存在显著热背景而非完全无风险。降水加权均值仅0.28 mm，500 hPa位势高度加权均值5920.01 gpm，环境偏干暖并受高压脊背景影响，但就阈值接近程度而言仍支持low。",
      "key_signals_zh": [
        "最高tmax 44.15°C、空间P95 tmax 43.53°C，均低于47.0°C阈值。",
        "加权平均tmax 41.51°C，空间P95 tmin 33.54°C，存在高温和暖夜背景。",
        "降水加权均值0.28 mm，500 hPa位势高度加权均值5920.01 gpm。"
      ]
    },
    {
      "lead_time_hours": 48,
      "system_base_risk_level": "low",
      "system_knowledge_triggered": false,
      "system_joint_final_risk_level": "low",
      "llm_advisory_risk_level": "medium",
      "llm_advisory_confidence": "medium",
      "agreement_with_system": false,
      "advisory_analysis_zh": "LLM独立判断为medium。相较24小时，最高tmax升至45.41°C、空间P95 tmax升至44.27°C，分别增加约1.26°C和0.74°C；空间P95 tmin升至34.66°C，暖夜信号增强。虽然温度高值尚未越过47.0°C阈值，且风速增强可能缓解部分近地面热负荷，但升温趋势、较高的500 hPa位势高度（加权均值5933.94 gpm）和很少降水支持将风险上调为medium。",
      "key_signals_zh": [
        "最高tmax 45.41°C、空间P95 tmax 44.27°C，较24小时继续上升但未达47.0°C。",
        "空间P95 tmin 34.66°C，较24小时增加约1.12°C，暖夜风险增强。",
        "500 hPa位势高度加权均值5933.94 gpm；降水加权均值仅0.40 mm。"
      ]
    },
    {
      "lead_time_hours": 72,
      "system_base_risk_level": "low",
      "system_knowledge_triggered": true,
      "system_joint_final_risk_level": "medium",
      "llm_advisory_risk_level": "high",
      "llm_advisory_confidence": "medium",
      "agreement_with_system": false,
      "advisory_analysis_zh": "LLM独立判断为high。最高tmax达47.78°C，已超过47.0°C热日阈值0.78°C；空间P95 tmax为44.86°C，较48小时再升高约0.59°C，空间P95 tmin为35.61°C、最高tmin为38.02°C，显示局地极端高温与夜间热负荷均加强。系统联合结果为medium，且知识触发为true；LLM上调至high是因为完整指标中的局地最高温已越阈，而不是基于任何结果信息。由于加权平均tmax仅41.27°C、空间P95未越阈，high的空间覆盖仍不确定，故置信度为medium。",
      "key_signals_zh": [
        "最高tmax 47.78°C，超过47.0°C热日阈值0.78°C。",
        "空间P95 tmax 44.86°C；空间P95 tmin 35.61°C，最高tmin 38.02°C。",
        "系统知识触发为true，但系统联合最终等级为medium；LLM依据局地越阈温度独立评为high。"
      ]
    }
  ],
  "uncertainty_analysis_zh": "24至72小时存在明确升温演变，但预报时效越长，不确定性通常越大。72小时的最高tmax越阈与区域空间P95、加权均值未越阈并存，说明风险可能集中于局地而非覆盖整个SA-03。水汽、IVT和风场在48—72小时增强，可能改变局地云量、混合和体感热环境，其净效应不能仅由现有汇总指标唯一确定。系统图谱在72小时触发但未提供可用于LLM复现的具体语义证据；因此LLM仅将其作为系统预测上下文，不将其替代为独立的高风险证据。",
  "limitations_zh": [
    "本报告仅使用预测阶段可得的数值预报指标、系统锁定预测、图谱触发状态和方法边界；未读取任何事件/对照标签、同期观测、命中漏报误报、新闻或事后答案。",
    "LLM意见是独立研究性综合判断，不是经验证或校准的正式预警模型，不能替代系统锁定结果或业务发布流程。",
    "72小时的high主要反映区域内局地最大值越过阈值；区域加权均值和空间P95仍明显较低，空间覆盖、暴露人口与持续时间均存在不确定性。",
    "系统方法开发门槛未通过，运行状态为research_only_blocked；因此无论系统或LLM风险等级为何，均不得授权正式预警。"
  ],
  "recommended_actions_zh": [
    "仅作为研究评估，继续监测后续预报周期中最高气温、夜间最低气温及其空间覆盖的变化。",
    "重点复核72小时局地超过47.0°C的空间范围、持续性和预报稳定性，避免将单点或局地最大值直接外推为全区域风险。",
    "在研究流程内记录系统与LLM于48、72小时的分歧，供独立评分与后续方法诊断；不得据此发布正式预警。"
  ],
  "provenance_summary_zh": "系统预测来自锁定文件 handoff/reports/dual_prediction_batch_v1/system_prediction_locks/heatwave_development.csv，prediction-lock SHA-256为3f88b1d7afa24e2731e67f3b42a47ef546a9801e879bc53ff1057b6fe945e047；方法选择锁定文件为manifests/joint_pipeline_selection_lock_v2.json，selection-lock SHA-256为8d3526d9f6528378d274129ad424cba39904a5cfcce2e164fc62fe7b4ca55545。图谱查询模式为live_neo4j。系统预测与LLM意见严格分离，且未访问真值。",
  "generation_mode": "openai_terra"
}
