{
  "schema_version": "agent_dual_prediction_report_v1",
  "report_mode": "system_plus_llm_advisory",
  "truth_accessed": false,
  "case_id": "20200725_00",
  "region_id": "SA-09",
  "hazard": "heavy_rain",
  "dataset_split": "independent_test",
  "focus_lead_time_hours": 48,
  "selected_joint_rule": "joint_rain_v2_base_kg_persistence_ratio0p25_support1_windows3",
  "development_gate_passed": true,
  "operating_status": "research_candidate",
  "formal_warning_allowed": false,
  "system_focus_risk_level": "medium",
  "llm_focus_advisory_risk_level": "medium",
  "llm_focus_confidence": "medium",
  "focus_agreement": true,
  "system_analysis_zh": "系统联合预测逐窗口为：24小时low、48小时medium、72小时high。基础方法为v2_base；三窗口knowledge_mode均为cross_window_persistence，knowledge_triggered均为false，系统联合风险分别保持low、medium、high。",
  "llm_advisory_summary_zh": "LLM独立综合意见：24小时为low，信号已有水汽和弱上升运动但降水量级及动力组织相对有限；48小时为medium，PWAT、降水和负omega增强，风险进入中等水平；72小时为high，降水、水汽输送和上升运动在多指标上同步增强，且跨窗口呈持续升级。意见与系统联合预测一致，但属于独立咨询判断。",
  "comparison_analysis_zh": "系统联合预测与LLM独立综合意见在24/48/72小时分别一致为low/medium/high。两者均识别出降水、整层水汽和上升运动随预报时效增强的三窗口演变；系统图谱知识规则未触发，因此系统结果保持基础方法输出。LLM意见独立参考完整MAZU-like指标及跨窗口变化，未使用任何同期观测或事后标签。",
  "timeline_analysis": [
    {
      "lead_time_hours": 24,
      "system_base_risk_level": "low",
      "system_knowledge_triggered": false,
      "system_joint_final_risk_level": "low",
      "llm_advisory_risk_level": "low",
      "llm_advisory_confidence": "medium",
      "agreement_with_system": true,
      "advisory_analysis_zh": "系统原始结果：base_method为v2_base，base_risk_level为low，forecast_features.primary_ratio为0.5742130000000001，support_count为2.0，knowledge_mode为cross_window_persistence，knowledge_triggered为false，joint_final_risk_level为low。LLM独立判断为low：weighted_mean daily_precip_total为0.87718874 mm，spatial_p95为2.871065 mm；weighted_mean IVT为199.26235 kg m-1 s-1，PWAT为54.323339 kg m-2，omega500为-0.0090384305 Pa s-1。已有水汽条件，但降水和上升运动综合强度尚处较低至有限水平，故暂评low。",
      "key_signals_zh": [
        "加权平均日降水0.87718874 mm，空间95分位2.871065 mm。",
        "加权平均PWAT为54.323339 kg m-2，IVT为199.26235 kg m-1 s-1。",
        "omega500加权平均为-0.0090384305 Pa s-1，平均上升信号较弱。",
        "系统primary_ratio为0.5742130000000001，support_count为2.0；图谱知识未触发。"
      ]
    },
    {
      "lead_time_hours": 48,
      "system_base_risk_level": "medium",
      "system_knowledge_triggered": false,
      "system_joint_final_risk_level": "medium",
      "llm_advisory_risk_level": "medium",
      "llm_advisory_confidence": "medium",
      "agreement_with_system": true,
      "advisory_analysis_zh": "系统原始结果：base_method为v2_base，base_risk_level为medium，forecast_features.primary_ratio为2.8422264，support_count为2.0，knowledge_mode为cross_window_persistence，knowledge_triggered为false，joint_final_risk_level为medium。LLM独立判断为medium：weighted_mean daily_precip_total升至5.836223 mm，spatial_p95升至14.211132 mm；PWAT升至60.33979 kg m-2，omega500加权平均增强为-0.088086675 Pa s-1，spatial_p95为-0.0024842646 Pa s-1；IVT为196.47939 kg m-1 s-1。相较24小时，降水、水汽和上升运动整体增强，虽IVT加权平均略低于24小时，但空间高值提高，综合风险上调至medium。",
      "key_signals_zh": [
        "加权平均日降水由24小时的0.87718874 mm升至5.836223 mm，空间95分位为14.211132 mm。",
        "PWAT升至60.33979 kg m-2，空间95分位为62.621892 kg m-2。",
        "omega500加权平均为-0.088086675 Pa s-1，显示更强的预报上升运动。",
        "IVT空间95分位升至254.9386 kg m-1 s-1；系统primary_ratio为2.8422264，support_count为2.0。"
      ]
    },
    {
      "lead_time_hours": 72,
      "system_base_risk_level": "high",
      "system_knowledge_triggered": false,
      "system_joint_final_risk_level": "high",
      "llm_advisory_risk_level": "high",
      "llm_advisory_confidence": "high",
      "agreement_with_system": true,
      "advisory_analysis_zh": "系统原始结果：base_method为v2_base，base_risk_level为high，forecast_features.primary_ratio为6.2395214，support_count为3.0，knowledge_mode为cross_window_persistence，knowledge_triggered为false，joint_final_risk_level为high。LLM独立判断为high：weighted_mean daily_precip_total升至18.436254 mm，spatial_p95为31.197607 mm；IVT升至255.99051 kg m-1 s-1，spatial_p95为305.27367 kg m-1 s-1；PWAT升至62.769545 kg m-2，spatial_p95为64.22195 kg m-2；omega500加权平均为-0.21121988 Pa s-1。三窗口表现为降水持续增加、水汽含量增加、IVT在72小时明显增强且上升运动加强；综合多指标一致性支持high。",
      "key_signals_zh": [
        "加权平均日降水达到18.436254 mm，空间95分位达到31.197607 mm。",
        "IVT加权平均为255.99051 kg m-1 s-1，空间95分位为305.27367 kg m-1 s-1。",
        "PWAT加权平均为62.769545 kg m-2，空间95分位为64.22195 kg m-2。",
        "omega500加权平均为-0.21121988 Pa s-1，较前两窗口更负，支持增强的上升运动信号。",
        "系统primary_ratio为6.2395214，support_count为3.0；图谱知识仍未触发。"
      ]
    }
  ],
  "uncertainty_analysis_zh": "不确定性主要来自预报时效增长、空间异质性以及不同指标并非完全同向：24至48小时IVT加权平均略有下降，但其空间高值上升；同时降水、PWAT和负omega增强。72小时多指标方向一致，因而LLM对high的置信度较高，但仍仅表示预测风险等级而非已发生事件。系统与LLM本案例无分歧；该一致性不应外推为一般性性能结论。",
  "limitations_zh": [
    "本报告仅为研究候选结果，不构成正式业务预警。",
    "预测阶段未访问事件/对照标签、同期观测、命中、漏报、误报或灾害答案。",
    "LLM判断依赖预报指标、三窗口演变和受控图谱上下文，不能替代实时监测、临近预报或人工业务会商。",
    "系统开发集指标不能直接代表本独立测试案例的实际表现。",
    "图谱知识规则在本案例三个窗口均未触发，相关知识增益无法由本案例单独验证。"
  ],
  "recommended_actions_zh": [
    "将24/48/72小时结果作为研究评估输出，保留系统结果与LLM意见的严格分离。",
    "重点复核72小时窗口的降水、水汽输送和上升运动预报演变，并结合未来可用的实时监测资料进行业务判断。",
    "由于formal_warning_allowed为false，不授权发布正式预警。",
    "在后续独立评估中分别评分系统预测和LLM咨询意见，不将二者合并为单一标签。"
  ],
  "provenance_summary_zh": "案例来自independent_test；预测锁定哈希为1ac65855766813b3221697ae67eeb2aa7235d6d488f288e266d611b2814331c6，选择锁定哈希为8d3526d9f6528378d274129ad424cba39904a5cfcce2e164fc62fe7b4ca55545。系统查询模式为live_neo4j。",
  "generation_mode": "openai_luna"
}
