{
  "schema_version": "agent_dual_prediction_report_v1",
  "report_mode": "system_plus_llm_advisory",
  "truth_accessed": false,
  "case_id": "20200622_00",
  "region_id": "SA-04",
  "hazard": "heatwave",
  "dataset_split": "development",
  "focus_lead_time_hours": 48,
  "selected_joint_rule": "joint_heat_pooled_median_loco_kg_temporal_or_spatial_margin1p0_windows3_maxmargin0p0",
  "development_gate_passed": false,
  "operating_status": "research_only_blocked",
  "formal_warning_allowed": false,
  "system_focus_risk_level": "low",
  "llm_focus_advisory_risk_level": "low",
  "llm_focus_confidence": "medium",
  "focus_agreement": true,
  "system_analysis_zh": "以下为不可修改的系统联合预测：所选规则为joint_heat_pooled_median_loco_kg_temporal_or_spatial_margin1p0_windows3_maxmargin0p0。24小时：base_method=pooled_median_loco，base_risk_level=low，forecast_features.candidate_tmax_degc=44.504769，hot_day_threshold_degc=47.249969，knowledge_mode=temporal_or_spatial，knowledge_triggered=false，joint_final_risk_level=low。48小时：base_method=pooled_median_loco，base_risk_level=low，forecast_features.candidate_tmax_degc=43.553395，hot_day_threshold_degc=47.249969，knowledge_mode=temporal_or_spatial，knowledge_triggered=false，joint_final_risk_level=low。72小时：base_method=pooled_median_loco，base_risk_level=low，forecast_features.candidate_tmax_degc=44.127207，hot_day_threshold_degc=47.249969，knowledge_mode=temporal_or_spatial，knowledge_triggered=false，joint_final_risk_level=low。",
  "llm_advisory_summary_zh": "LLM独立综合意见：24/48/72小时均为low、置信度medium。三个窗口均显示偏热环境和很低降水，但预测Tmax的区域高分位约为43.01°C、42.06°C、42.64°C，低于系统阈值47.249969°C；72小时虽较48小时回升，却未构成超过阈值的持续升级信号。该意见与锁定系统联合预测一致，但其依据和评分结论独立形成。",
  "comparison_analysis_zh": "系统联合预测与LLM独立综合意见在24、48、72小时窗口均为low，因而三个窗口均一致。系统结果按锁定的 pooled_median_loco 与知识图谱联合规则保存，三个窗口的图谱触发均为否；LLM则独立依据可用预报指标判断：区域高温信号存在，但Tmax候选值/高分位值均未达到系统给出的47.249969°C热日阈值，且缺乏跨窗口持续增强的清晰证据。LLM没有使用任何同期观测、标签或事后结果。",
  "timeline_analysis": [
    {
      "lead_time_hours": 24,
      "system_base_risk_level": "low",
      "system_knowledge_triggered": false,
      "system_joint_final_risk_level": "low",
      "llm_advisory_risk_level": "low",
      "llm_advisory_confidence": "medium",
      "agreement_with_system": true,
      "advisory_analysis_zh": "LLM独立意见为low，置信度medium。24小时区域Tmax加权均值40.79°C、空间P95为43.01°C、最大值43.67°C；Tmin加权均值28.54°C，提示存在热暴露背景，但Tmax高分位仍低于47.249969°C阈值。降水加权均值仅0.12 mm，500 hPa位势高度加权均值5871.18 gpm，支持偏干暖环境；然而这些信息不足以把综合风险提升为medium。",
      "key_signals_zh": [
        "Tmax：加权均值40.79°C，P95 43.01°C，最大43.67°C。",
        "Tmin加权均值28.54°C，存在夜间偏暖背景。",
        "降水加权均值0.12 mm；500 hPa位势高度加权均值5871.18 gpm。",
        "系统候选Tmax 44.504769°C，低于47.249969°C阈值；知识图谱未触发。"
      ]
    },
    {
      "lead_time_hours": 48,
      "system_base_risk_level": "low",
      "system_knowledge_triggered": false,
      "system_joint_final_risk_level": "low",
      "llm_advisory_risk_level": "low",
      "llm_advisory_confidence": "medium",
      "agreement_with_system": true,
      "advisory_analysis_zh": "LLM独立意见为low，置信度medium。相较24小时，48小时Tmax的空间P95降至42.06°C，Tmin加权均值降至27.79°C，且IVT加权均值由164.81降至108.18 kg m-1 s-1；尽管500 hPa位势高度加权均值升至5878.67 gpm，未见温度指标同步增强。因而该窗口是三者中相对偏弱的热风险信号。",
      "key_signals_zh": [
        "Tmax：加权均值40.78°C，P95 42.06°C，最大43.85°C。",
        "Tmin加权均值27.79°C，低于24小时窗口。",
        "500 hPa位势高度加权均值5878.67 gpm，但IVT加权均值108.18 kg m-1 s-1。",
        "系统候选Tmax 43.553395°C，低于47.249969°C阈值；知识图谱未触发。"
      ]
    },
    {
      "lead_time_hours": 72,
      "system_base_risk_level": "low",
      "system_knowledge_triggered": false,
      "system_joint_final_risk_level": "low",
      "llm_advisory_risk_level": "low",
      "llm_advisory_confidence": "medium",
      "agreement_with_system": true,
      "advisory_analysis_zh": "LLM独立意见为low，置信度medium。72小时Tmax加权均值升至41.36°C、P95回升至42.64°C，Tmin加权均值升至29.13°C；500 hPa位势高度加权均值进一步升至5889.33 gpm，近地面风加权均值降至3.48 m s-1，显示相对48小时有再增强的热暴露条件。与此同时，Tmax高分位仍未达阈值，且PWAT空间P95升至30.15 kg m-2、IVT空间P95为212.67 kg m-1 s-1，表明环境并非单一、确定性的干热型态，故维持low而非升级。",
      "key_signals_zh": [
        "Tmax：加权均值41.36°C，P95 42.64°C，最大44.27°C；较48小时回升。",
        "Tmin加权均值29.13°C；500 hPa位势高度加权均值5889.33 gpm。",
        "10 m风加权均值3.48 m s-1；PWAT P95为30.15 kg m-2，存在环境异质性。",
        "系统候选Tmax 44.127207°C，低于47.249969°C阈值；知识图谱未触发。"
      ]
    }
  ],
  "uncertainty_analysis_zh": "三窗口演变为：24小时偏热且干燥，48小时温度高分位和夜间温度略减弱，72小时温度、夜间温度和高空位势高度再度抬升，同时低层风减弱；因此LLM识别到72小时相对回升，但没有跨越阈值或形成足以升级的稳定多指标合证。置信度设为medium而非high，原因是预报时效递增、指标存在空间范围和湿度/输送信号异质性，且该研究方法开发准入未通过。系统和LLM本次无风险等级分歧；若以后出现分歧，应保留系统锁定结果，并将LLM结果仅作为独立研究意见处理。",
  "limitations_zh": [
    "这是development数据划分中的研究性个案；所选联合方法未通过开发准入门槛，operating_status为research_only_blocked。",
    "预报场存在空间离散性：例如24小时Tmax范围为34.54–43.67°C，单一汇总指标不能完整表达局地暴露差异。",
    "LLM意见仅基于预测时可用的气象指标、三窗口演变、图谱触发状态和方法边界；未纳入任何同期观测、事件/对照标签、命中漏报误报、灾害新闻或事后答案。",
    "低风险不等于不存在高温暴露；它仅表示在本研究定义、当前阈值参照和可用预测证据下，未形成medium或high的综合风险判定。"
  ],
  "recommended_actions_zh": [
    "仅将结果用于研究记录、后续独立评分和方法审查；不得作为正式高温预警发布依据。",
    "持续查看后续预报更新，重点关注Tmax是否向47.249969°C阈值接近或超过，以及夜间最低温、500 hPa位势高度和近地面风是否共同强化热暴露。",
    "若开展风险沟通或准备工作，应明确其为常规审慎准备而非由本研究模型授权的预警；即使LLM未来给出high，本个案的research_only_blocked状态也不授权正式预警。"
  ],
  "provenance_summary_zh": "系统预测来自live_neo4j查询，并受预测锁定文件handoff/reports/dual_prediction_batch_v1/system_prediction_locks/heatwave_development.csv约束；prediction_lock_sha256为3f88b1d7afa24e2731e67f3b42a47ef546a9801e879bc53ff1057b6fe945e047。联合规则选择受manifests/joint_pipeline_selection_lock_v2.json锁定，selection_lock_sha256为8d3526d9f6528378d274129ad424cba39904a5cfcce2e164fc62fe7b4ca55545。",
  "generation_mode": "openai_terra"
}
