{
  "schema_version": "agent_dual_prediction_report_v1",
  "report_mode": "system_plus_llm_advisory",
  "truth_accessed": false,
  "case_id": "20200627_00",
  "region_id": "SA-04",
  "hazard": "heatwave",
  "dataset_split": "development",
  "focus_lead_time_hours": 48,
  "selected_joint_rule": "joint_heat_pooled_median_loco_kg_temporal_or_spatial_margin1p0_windows3_maxmargin0p0",
  "development_gate_passed": false,
  "operating_status": "research_only_blocked",
  "formal_warning_allowed": false,
  "system_focus_risk_level": "high",
  "llm_focus_advisory_risk_level": "medium",
  "llm_focus_confidence": "medium",
  "focus_agreement": false,
  "system_analysis_zh": "锁定的系统联合预测：24小时，基础风险low、图谱知识已触发、联合最终风险medium；48小时，基础风险low、图谱知识已触发、联合最终风险high；72小时，基础风险low、图谱知识已触发、联合最终风险high。系统基础候选最高温分别为46.427614°C、46.479405°C、46.934674°C，系统热日阈值为47.249969°C。上述系统联合等级为不可修改的锁定结果。",
  "llm_advisory_summary_zh": "独立LLM综合意见：未来24小时为medium，48小时为medium，72小时为medium，置信度均为medium。预测场显示高温背景持续，72小时区域加权平均tmax升至44.31°C、空间P95升至45.46°C，且P95最低温升至33.94°C、近地风减弱至2.82 m/s，支持持续热压力的中等风险判断；但预测窗口中区域P95 tmax均未达到系统热日阈值47.249969°C，且高温覆盖与持续时间仍有预测不确定性，故不独立判为high。该意见仅为可单独评分的研究性预测意见，不构成正式预警。",
  "comparison_analysis_zh": "系统联合预测按锁定结果为24小时medium、48小时high、72小时high：其基础方法三窗口均为low，但图谱的temporal_or_spatial知识触发使联合等级上调。LLM独立意见为24小时medium、48小时medium、72小时medium：24小时与系统一致；48和72小时，LLM认可高温背景增强及夜间热压力，但由于区域高分位最高温仍低于系统给出的热日阈值，且仅凭单次预测场无法确认持续性与影响程度，未上调至high。两者共同显示从24至72小时热压力维持并在72小时表现为区域高温与弱风的叠加；分歧仅在系统图谱触发所带来的48/72小时high升级。",
  "timeline_analysis": [
    {
      "lead_time_hours": 24,
      "system_base_risk_level": "low",
      "system_knowledge_triggered": true,
      "system_joint_final_risk_level": "medium",
      "llm_advisory_risk_level": "medium",
      "llm_advisory_confidence": "medium",
      "agreement_with_system": true,
      "advisory_analysis_zh": "LLM独立判断为medium、置信度medium。区域加权平均tmax为43.49°C、空间P95为44.96°C、最大值45.77°C；加权平均tmin为30.92°C、P95为33.05°C，显示日间炎热并伴随较高夜间温度。500 hPa加权平均位势高度5900.02 gpm，降水加权平均仅0.14 mm，支持偏热偏干背景；但P95 tmax未达47.249969°C阈值，且10 m风加权平均4.47 m/s仍不算很弱，故维持medium而非high。",
      "key_signals_zh": [
        "tmax：加权平均43.49°C，空间P95 44.96°C，最大45.77°C。",
        "tmin：加权平均30.92°C，空间P95 33.05°C，存在夜间热压力信号。",
        "降水加权平均0.14 mm、500 hPa位势高度加权平均5900.02 gpm，符合偏干暖背景。",
        "区域P95 tmax低于47.249969°C热日阈值；10 m风加权平均4.47 m/s，限制独立升至high。"
      ]
    },
    {
      "lead_time_hours": 48,
      "system_base_risk_level": "low",
      "system_knowledge_triggered": true,
      "system_joint_final_risk_level": "high",
      "llm_advisory_risk_level": "medium",
      "llm_advisory_confidence": "medium",
      "agreement_with_system": false,
      "advisory_analysis_zh": "LLM独立判断为medium、置信度medium。相较24小时，加权平均tmax小幅升至43.65°C，最大tmax升至46.38°C，P95最低温升至33.27°C；近地风加权平均降至3.50 m/s，热量滞留条件有所增强。与此同时，P95 tmax为45.01°C，仍低于47.249969°C阈值；500 hPa位势高度和水汽输送较24小时回落，单凭预测指标不足以确认high。系统因图谱触发升为high，LLM不将该触发单独视为足够的high证据。",
      "key_signals_zh": [
        "tmax：加权平均43.65°C、最大46.38°C，较24小时上升。",
        "tmin空间P95为33.27°C，夜间热压力维持。",
        "10 m风加权平均3.50 m/s，较24小时减弱。",
        "tmax空间P95 45.01°C仍低于47.249969°C阈值；500 hPa位势高度加权平均降至5892.64 gpm。"
      ]
    },
    {
      "lead_time_hours": 72,
      "system_base_risk_level": "low",
      "system_knowledge_triggered": true,
      "system_joint_final_risk_level": "high",
      "llm_advisory_risk_level": "medium",
      "llm_advisory_confidence": "medium",
      "agreement_with_system": false,
      "advisory_analysis_zh": "LLM独立判断为medium、置信度medium。三窗口中，此时区域热背景最广泛：加权平均tmax升至44.31°C、空间P95升至45.46°C，加权平均t2m升至37.52°C；P95最低温升至33.94°C。同时10 m风加权平均进一步减至2.82 m/s，降水加权平均仍仅0.28 mm，表明高温与弱风组合使热压力延续。限制因素是最大tmax回落至45.99°C、P95 tmax依然低于47.249969°C阈值，500 hPa位势高度继续下降至5882.46 gpm；持续性、局地覆盖和影响均无法由当前预测场确认。因此不同于系统high，LLM保留medium。",
      "key_signals_zh": [
        "tmax：加权平均44.31°C、空间P95 45.46°C，为三窗口最高。",
        "t2m加权平均37.52°C，tmin空间P95 33.94°C，日夜热压力增强。",
        "10 m风加权平均2.82 m/s，为三窗口最低；降水加权平均0.28 mm，维持偏干。",
        "P95 tmax仍低于47.249969°C阈值，最大tmax45.99°C且500 hPa位势高度加权平均降至5882.46 gpm，令high判断不确定。"
      ]
    }
  ],
  "uncertainty_analysis_zh": "24至72小时的温度、最低温和风速演变支持热压力持续并在72小时增强，但较长提前期通常具有更大的预报不确定性。系统基础方法始终为low，而联合图谱触发在全部窗口存在并推动系统由24小时medium升至48/72小时high；该触发是锁定系统规则的一部分，不可由LLM改写。LLM则将阈值距离、区域统计量及环流/风场的混合信号纳入独立判断：48/72小时有增强证据，但不足以在未验证预测阶段确认high。由于方法开发门槛未通过且运行状态为research_only_blocked，任何风险等级均只限研究候选用途。",
  "limitations_zh": [
    "本报告严格未访问事件或对照标签、同期观测、命中/漏报/误报信息、灾害新闻或任何事后答案。",
    "系统方法处于research_only_blocked，且development_gate_passed为false；无论系统或LLM等级为何，均不得将本报告用于授权正式预警。",
    "LLM意见只使用本次可用预测指标、三窗口演变、系统提供的图谱触发上下文和方法边界；它不等同于观测验证或影响评估。",
    "各温度、风和环流指标为区域统计量，不能解析局地暴露、城市热岛、脆弱人群、停电或持续多日累积热负荷。",
    "图谱触发的具体因果强度和空间代表性未由这些数值指标单独量化，因此系统升级与LLM保守判断之间存在不可消除的结构性不确定性。"
  ],
  "recommended_actions_zh": [
    "仅以研究运行方式持续复核24/48/72小时温度、最低温和近地风预报的更新；重点检查72小时高温与弱风组合是否保持。",
    "在不发布正式预警的前提下，准备内部热风险态势材料，并明确标注为research_only_blocked和非业务预警。",
    "将系统图谱触发与数值温度阈值接近程度并列展示：系统48/72小时为high，LLM独立意见为medium，避免将任一结果误表述为已验证事实。",
    "如后续开展方法改进，应在独立于本预测的开发和评估流程中处理；本报告不据此推断任何结果。"
  ],
  "provenance_summary_zh": "系统预测来自live_neo4j查询，且系统时间线受prediction lock约束（SHA-256：3f88b1d7afa24e2731e67f3b42a47ef546a9801e879bc53ff1057b6fe945e047）；联合规则选择受selection lock约束（SHA-256：8d3526d9f6528378d274129ad424cba39904a5cfcce2e164fc62fe7b4ca55545）。数据划分为development。LLM部分在锁定系统结果之外，基于完整的、预测时可用的MAZU-like指标独立形成，未改变系统任何等级。",
  "generation_mode": "openai_terra"
}
