{
  "schema_version": "agent_dual_prediction_report_v1",
  "report_mode": "system_plus_llm_advisory",
  "truth_accessed": false,
  "case_id": "20200908_00",
  "region_id": "SA-04",
  "hazard": "heatwave",
  "dataset_split": "development",
  "focus_lead_time_hours": 48,
  "selected_joint_rule": "joint_heat_pooled_median_loco_kg_temporal_or_spatial_margin1p0_windows3_maxmargin0p0",
  "development_gate_passed": false,
  "operating_status": "research_only_blocked",
  "formal_warning_allowed": false,
  "system_focus_risk_level": "low",
  "llm_focus_advisory_risk_level": "medium",
  "llm_focus_confidence": "medium",
  "focus_agreement": false,
  "system_analysis_zh": "锁定系统联合预测（不可修改）：采用joint_heat_pooled_median_loco_kg_temporal_or_spatial_margin1p0_windows3_maxmargin0p0。24小时：基线风险low、图谱触发false、联合最终风险low，candidate_tmax_degc=45.922332，hot_day_threshold_degc=47.0。48小时：基线风险low、图谱触发false、联合最终风险low，candidate_tmax_degc=46.164531，hot_day_threshold_degc=47.0。72小时：基线风险low、图谱触发false、联合最终风险low，candidate_tmax_degc=45.776162，hot_day_threshold_degc=47.0。",
  "llm_advisory_summary_zh": "LLM独立综合预测意见：24、48和72小时均评为medium。三窗口均显示区域暖热背景，最高温空间极值约45.13–46.45°C，接近但未达到系统使用的47.0°C候选阈值；同时加权平均最高温由40.89°C升至42.95°C，近地面平均风由3.00降至2.62 m/s，最低温加权平均约29.24–29.46°C，提示暖热暴露和夜间恢复受限风险在后期未明显缓解。由于没有预测值越过系统阈值、空间极端与区域平均之间存在差异，且图谱未触发，LLM不将风险升为high。该意见仅供独立研究评分，不能形成正式预警。",
  "comparison_analysis_zh": "系统联合预测在24/48/72小时均为low；LLM独立综合意见在三窗口均为medium，因此逐窗口均不一致。分歧来自LLM对区域高温暴露、偏高夜间最低温、弱近地风及跨窗口持续暖化的综合权重更高；系统则严格遵循已锁定的47.0°C候选日最高温阈值、池化中位数方法与未触发的图谱条件。两者均仅基于预测期信息，未使用任何同期结果或事后标签。",
  "timeline_analysis": [
    {
      "lead_time_hours": 24,
      "system_base_risk_level": "low",
      "system_knowledge_triggered": false,
      "system_joint_final_risk_level": "low",
      "llm_advisory_risk_level": "medium",
      "llm_advisory_confidence": "medium",
      "agreement_with_system": false,
      "advisory_analysis_zh": "LLM独立意见为medium：最高温最大值46.45°C、空间P95为44.46°C，虽低于47.0°C候选阈值但接近该阈值；加权平均t2m为34.95°C、加权平均tmin为29.31°C，且近地面平均风为3.00 m/s。500 hPa位势高度加权平均5902.02 gpm，降水加权平均仅0.10 mm，呈现暖热且少雨的预测背景。图谱未触发，且极端高温主要体现于空间最大值而非全域平均，故为medium而非high。",
      "key_signals_zh": [
        "tmax最大值46.45°C，较47.0°C候选阈值低0.55°C",
        "tmax空间P95为44.46°C，加权平均为40.89°C",
        "tmin加权平均29.31°C，夜间仍偏暖",
        "近地面风速加权平均3.00 m/s",
        "降水加权平均0.10 mm，500 hPa位势高度加权平均5902.02 gpm",
        "系统图谱条件未触发"
      ]
    },
    {
      "lead_time_hours": 48,
      "system_base_risk_level": "low",
      "system_knowledge_triggered": false,
      "system_joint_final_risk_level": "low",
      "llm_advisory_risk_level": "medium",
      "llm_advisory_confidence": "medium",
      "agreement_with_system": false,
      "advisory_analysis_zh": "LLM独立意见为medium：相较24小时，区域加权平均tmax升至42.25°C、t2m升至35.73°C，显示区域平均暖热程度增强；但最高温最大值45.82°C仍未达到47.0°C候选阈值。tmin加权平均29.46°C、近地面平均风2.76 m/s，维持偏暖夜间与较弱通风的组合。降水加权平均0.22 mm，500 hPa位势高度加权平均降至5886.91 gpm；在无图谱触发及阈值未越过条件下，维持medium且置信度为medium。",
      "key_signals_zh": [
        "tmax加权平均42.25°C，较24小时上升1.35°C",
        "t2m加权平均35.73°C，较24小时上升0.77°C",
        "tmax最大值45.82°C，仍低于47.0°C候选阈值",
        "tmin加权平均29.46°C，近地面风速加权平均2.76 m/s",
        "降水加权平均0.22 mm",
        "系统图谱条件未触发"
      ]
    },
    {
      "lead_time_hours": 72,
      "system_base_risk_level": "low",
      "system_knowledge_triggered": false,
      "system_joint_final_risk_level": "low",
      "llm_advisory_risk_level": "medium",
      "llm_advisory_confidence": "medium",
      "agreement_with_system": false,
      "advisory_analysis_zh": "LLM独立意见为medium：区域加权平均tmax进一步升至42.95°C、t2m升至36.00°C，表明24–72小时区域平均暖热信号持续加强；但最高温最大值降至45.13°C、空间P95为44.31°C，仍未达到47.0°C候选阈值。tmin加权平均29.24°C、近地面平均风2.62 m/s，夜间暖热和较弱通风仍值得关注。降水加权平均0.25 mm，500 hPa位势高度加权平均5873.49 gpm；由于极端上限回落、图谱未触发和较长预报时效，维持medium而不升为high。",
      "key_signals_zh": [
        "tmax加权平均42.95°C，为三窗口最高",
        "t2m加权平均36.00°C，为三窗口最高",
        "tmax最大值45.13°C、空间P95为44.31°C，均低于47.0°C候选阈值",
        "tmin加权平均29.24°C，近地面风速加权平均2.62 m/s",
        "降水加权平均0.25 mm",
        "系统图谱条件未触发"
      ]
    }
  ],
  "uncertainty_analysis_zh": "24至72小时的演变并非单向一致：区域加权平均最高温和2米气温逐步上升，而最高温空间最大值从46.45°C回落至45.13°C，说明区域平均暖化与局地极端上限存在不一致。系统候选最高温在三窗口均低于47.0°C阈值，且图谱未触发，支持系统low；LLM将近阈值空间高温、偏暖最低温、弱风和少雨背景综合为medium，但该整合没有经过本个案外的独立校准。48和72小时还存在通常更大的预报时效不确定性。全程未访问真值、同期观测、事件或对照标签、命中漏报误报、新闻或任何事后答案。",
  "limitations_zh": [
    "该个案处于development数据集，且开发门槛未通过；给出的结果仅限研究比较，不构成运行部署结论。",
    "高温方法状态为research_only_blocked；无论系统或LLM意见为何等级，均不得据此授权正式预警。",
    "LLM意见是基于可用预测指标的独立综合判断，不是经过校准、验证或替代锁定系统规则的风险模型。",
    "温度场统计量描述的是区域汇总及空间分布，不能替代局地暴露、人群脆弱性、城市热岛、持续日数或影响阈值信息。",
    "图谱仅提供“未触发”状态，未提供可量化的具体关系强度；其对LLM判断的支持有限。"
  ],
  "recommended_actions_zh": [
    "将本报告仅作为研究候选结果归档，并保持系统预测锁及方法选择锁不变。",
    "对24–72小时持续跟踪预测温度、夜间最低温、风速和空间高温范围的后续预报更新。",
    "如用于后续研究，独立评估LLM综合意见的校准性与增益；不得将其回写或用于修改本次系统锁定预测。",
    "在开发门槛通过并完成独立验证前，不发布或授权任何正式高温预警。"
  ],
  "provenance_summary_zh": "系统预测锁定文件为handoff/reports/dual_prediction_batch_v1/system_prediction_locks/heatwave_development.csv，prediction lock SHA-256为3f88b1d7afa24e2731e67f3b42a47ef546a9801e879bc53ff1057b6fe945e047；方法选择锁定文件为manifests/joint_pipeline_selection_lock_v2.json，selection lock SHA-256为8d3526d9f6528378d274129ad424cba39904a5cfcce2e164fc62fe7b4ca55545。图谱查询模式为live_neo4j。系统时间线按锁定结果原样保留；LLM意见与其严格分离。",
  "generation_mode": "openai_terra"
}
