{
  "schema_version": "agent_dual_prediction_report_v1",
  "report_mode": "system_plus_llm_advisory",
  "truth_accessed": false,
  "case_id": "20200806_00",
  "region_id": "SA-04",
  "hazard": "heatwave",
  "dataset_split": "development",
  "focus_lead_time_hours": 48,
  "selected_joint_rule": "joint_heat_pooled_median_loco_kg_temporal_or_spatial_margin1p0_windows3_maxmargin0p0",
  "development_gate_passed": false,
  "operating_status": "research_only_blocked",
  "formal_warning_allowed": false,
  "system_focus_risk_level": "high",
  "llm_focus_advisory_risk_level": "medium",
  "llm_focus_confidence": "medium",
  "focus_agreement": false,
  "system_analysis_zh": "系统联合预测逐窗口保留如下：24小时base_method为pooled_median_loco、base_risk_level为low、joint_final_risk_level为medium、knowledge_mode为temporal_or_spatial、knowledge_triggered为true；48小时base_risk_level为low、joint_final_risk_level为high、knowledge_triggered为true；72小时base_risk_level为low、joint_final_risk_level为high、knowledge_triggered为true。系统候选最高温分别为46.745273°C、46.553756°C和46.856382°C，热日阈值均为47.249969°C。",
  "llm_advisory_summary_zh": "LLM综合意见为：24小时medium、48小时medium、72小时high。判断依据是最高温接近但未达到热日阈值、近地面高温背景、最低温在72小时明显升高、低风速条件以及72小时仍偏高的可降水量；24至48小时存在最高温和500 hPa位势高度回落，故不将48小时上调至high；72小时温度与夜间热负荷信号增强，故恢复为high。",
  "comparison_analysis_zh": "系统联合预测显示风险由24小时的medium升至48小时和72小时的high；LLM独立意见在24小时与系统一致、48小时低于系统、72小时与系统一致。分歧主要出现在48小时：候选最高温仍低于热日阈值，且500 hPa位势高度、近地面最高温和850 hPa风速相较24小时没有形成更强的持续增温信号，因此LLM将该窗口评为medium；72小时则出现最高温回升、近地面温度维持偏高、最低温升高、10米风减弱以及较高可降水量，综合支持high。两类预测均仅代表研究阶段预测，不构成正式业务预警。",
  "timeline_analysis": [
    {
      "lead_time_hours": 24,
      "system_base_risk_level": "low",
      "system_knowledge_triggered": true,
      "system_joint_final_risk_level": "medium",
      "llm_advisory_risk_level": "medium",
      "llm_advisory_confidence": "medium",
      "agreement_with_system": true,
      "advisory_analysis_zh": "候选最高温为46.745273°C，低于47.249969°C阈值；空间最高tmax为46.228577°C、空间p95为45.273853°C，500 hPa位势高度加权均值为5869.6322 gpm，近地面温度加权均值为37.791509°C，10米风速加权均值为5.0321981 m/s。高温背景存在，但阈值余量和空间统计量使LLM评为medium。",
      "key_signals_zh": [
        "候选最高温46.745273°C，热日阈值47.249969°C，差值约0.505°C。",
        "t2m加权均值37.791509°C，tmax加权均值43.950745°C。",
        "500 hPa位势高度加权均值5869.6322 gpm。",
        "日降水加权均值0.21522869 mm，10米风速加权均值5.0321981 m/s。",
        "系统知识触发：true；系统联合风险：medium。"
      ]
    },
    {
      "lead_time_hours": 48,
      "system_base_risk_level": "low",
      "system_knowledge_triggered": true,
      "system_joint_final_risk_level": "high",
      "llm_advisory_risk_level": "medium",
      "llm_advisory_confidence": "medium",
      "agreement_with_system": false,
      "advisory_analysis_zh": "候选最高温降至45.62616°C，低于47.249969°C阈值；空间最高tmax为45.62616°C、空间p95为45.082336°C，500 hPa位势高度加权均值降至5867.5396 gpm，近地面温度加权均值为37.597685°C，10米风速降至4.1564119 m/s。水汽增加但温度信号较24小时减弱，故LLM评为medium；系统因图谱知识触发将联合风险评为high，形成分歧。",
      "key_signals_zh": [
        "候选最高温45.62616°C，较24小时下降，距阈值约1.624°C。",
        "t2m加权均值37.597685°C，tmax加权均值43.647504°C。",
        "PWAT加权均值升至27.852338 kg m-2，但500 hPa位势高度加权均值为5867.5396 gpm。",
        "10米风速加权均值降至4.1564119 m/s，日降水加权均值为0.36989718 mm。",
        "系统知识触发：true；系统联合风险：high。"
      ]
    },
    {
      "lead_time_hours": 72,
      "system_base_risk_level": "low",
      "system_knowledge_triggered": true,
      "system_joint_final_risk_level": "high",
      "llm_advisory_risk_level": "high",
      "llm_advisory_confidence": "medium",
      "agreement_with_system": true,
      "advisory_analysis_zh": "候选最高温回升至46.856382°C，接近47.249969°C阈值；空间最高tmax为46.726837°C、空间p95为45.384962°C，t2m加权均值升至38.239055°C，tmin加权均值升至33.340843°C，10米风速降至3.1726198 m/s。500 hPa位势高度加权均值降至5860.3082 gpm，PWAT加权均值升至31.445068 kg m-2。最高温回升、夜间温度升高和低风速共同提高持续热负荷，LLM评为high，并与系统一致。",
      "key_signals_zh": [
        "候选最高温46.856382°C，距阈值约0.394°C。",
        "t2m加权均值38.239055°C、tmin加权均值33.340843°C，均高于48小时。",
        "10米风速加权均值3.1726198 m/s，低于24小时和48小时。",
        "PWAT加权均值31.445068 kg m-2，日降水加权均值0.43861091 mm。",
        "系统知识触发：true；系统联合风险：high。"
      ]
    }
  ],
  "uncertainty_analysis_zh": "24至48小时的候选最高温下降、500 hPa位势高度小幅回落和水汽增加并存，说明热风险并非由单一指标决定；72小时最高温回升、最低温升高和低风速则使持续热负荷判断更偏高。系统与LLM的主要不确定性来自系统图谱知识触发对基础风险的联合调整，以及LLM对阈值余量、温度持续性和空间统计量权衡不同。由于开发门槛未通过、正式预警被禁止且缺少同期验证信息，本报告仅适用于受控研究评估。",
  "limitations_zh": [
    "候选最高温在三个窗口均低于给定热日阈值，风险等级对空间极值、持续性和图谱知识触发较为敏感。",
    "可用指标为预测阶段的空间统计量，不能替代同期观测、影响评估或业务核验。",
    "系统方法开发门槛未通过，当前运行边界为research_only_blocked；不得据此发布正式预警。",
    "LLM意见是独立综合判断，不改变系统联合预测，也不具有业务授权效力。"
  ],
  "recommended_actions_zh": [
    "保留系统联合预测原值，并将LLM意见作为独立研究基线单独评分。",
    "继续监测24/48/72小时预测窗口中最高温、最低温、近地面温度、风速和水汽指标的演变。",
    "重点复核48小时温度回落与72小时再升温之间的时序转折及空间一致性。",
    "在开发门槛未通过且formal_warning_allowed为false的条件下，不发布正式预警。"
  ],
  "provenance_summary_zh": "预测来自development数据集和live_neo4j查询模式。系统预测锁哈希为3f88b1d7afa24e2731e67f3b42a47ef546a9801e879bc53ff1057b6fe945e047；联合方法选择锁哈希为8d3526d9f6528378d274129ad424cba39904a5cfcce2e164fc62fe7b4ca55545。系统与LLM均未访问真值；两者均不是正式业务预警。",
  "generation_mode": "openai_luna"
}
