{
  "schema_version": "agent_dual_prediction_report_v1",
  "report_mode": "system_plus_llm_advisory",
  "truth_accessed": false,
  "case_id": "20201119_00",
  "region_id": "SA-03",
  "hazard": "heavy_rain",
  "dataset_split": "development",
  "focus_lead_time_hours": 48,
  "selected_joint_rule": "joint_rain_v2_base_kg_persistence_ratio0p25_support1_windows3",
  "development_gate_passed": true,
  "operating_status": "research_candidate",
  "formal_warning_allowed": false,
  "system_focus_risk_level": "medium",
  "llm_focus_advisory_risk_level": "medium",
  "llm_focus_confidence": "medium",
  "focus_agreement": true,
  "system_analysis_zh": "系统联合预测逐窗口保留如下：24小时base_risk_level为low、joint_final_risk_level为low、primary_ratio为0.040069578、support_count为4.0、knowledge_triggered为false；48小时base_risk_level为medium、joint_final_risk_level为medium、primary_ratio为1.58019392、support_count为4.0、knowledge_triggered为false；72小时base_risk_level为medium、joint_final_risk_level为medium、primary_ratio为1.36816876、support_count为3.0、knowledge_triggered为false。三个窗口的knowledge_mode均为cross_window_persistence，系统联合规则为joint_rain_v2_base_kg_persistence_ratio0p25_support1_windows3。",
  "llm_advisory_summary_zh": "LLM独立意见为24小时low、48小时medium、72小时medium，重点窗口为48小时。24小时加权平均降水仅0.104 mm、空间P95为0.200 mm，虽有中等水汽背景，但直接降水信号弱；48小时降水加权平均升至2.198 mm、空间P95升至7.901 mm，同时IVT加权平均由180.666升至324.529 kg m-1 s-1、PWAT由24.606升至32.075 kg m-2，构成最强的综合湿润和输送信号；72小时降水仍保持一定空间高值，但IVT回落至176.724、加权平均降水回落至1.832 mm，故维持medium。",
  "comparison_analysis_zh": "系统联合预测为24小时low、48小时medium、72小时medium；LLM独立综合意见亦为low、medium、medium，因此三个窗口均分类一致。两者虽无风险等级分歧，但依据不同：系统严格保留v2_base及其联合规则输出，且三个窗口均未触发图谱知识修正；LLM则综合考察降水、整层水汽输送、可降水量和500 hPa垂直运动的窗口演变。24小时降水信号很弱，支持low；48小时水汽和降水增强，支持medium；72小时降水仍有空间高值但水汽输送较48小时回落，维持medium而不上调。该比较仅基于预测时可用信息，不涉及同期观测或事后标签。",
  "timeline_analysis": [
    {
      "lead_time_hours": 24,
      "system_base_risk_level": "low",
      "system_knowledge_triggered": false,
      "system_joint_final_risk_level": "low",
      "llm_advisory_risk_level": "low",
      "llm_advisory_confidence": "medium",
      "agreement_with_system": true,
      "advisory_analysis_zh": "LLM判断为low。24小时daily_precip_total加权平均为0.10357102 mm、空间P95为0.20034789 mm，IVT加权平均为180.66631 kg m-1 s-1、PWAT加权平均为24.605902 kg m-2；omega500加权平均为-0.08025451 Pa s-1，显示一定上升运动背景，但降水量级和空间覆盖信号偏弱。系统维持low，LLM与系统一致。",
      "key_signals_zh": [
        "daily_precip_total加权平均0.10357102 mm，空间P95 0.20034789 mm",
        "IVT加权平均180.66631 kg m-1 s-1，空间P95 232.93708 kg m-1 s-1",
        "PWAT加权平均24.605902 kg m-2",
        "omega500加权平均-0.08025451 Pa s-1，但直接降水信号弱",
        "图谱cross_window_persistence未触发知识修正"
      ]
    },
    {
      "lead_time_hours": 48,
      "system_base_risk_level": "medium",
      "system_knowledge_triggered": false,
      "system_joint_final_risk_level": "medium",
      "llm_advisory_risk_level": "medium",
      "llm_advisory_confidence": "medium",
      "agreement_with_system": true,
      "advisory_analysis_zh": "LLM判断为medium。该窗口综合信号最强：daily_precip_total加权平均升至2.1984986 mm、空间P95升至7.9009696 mm；IVT加权平均升至324.52936 kg m-1 s-1、空间P95为462.58331 kg m-1 s-1；PWAT加权平均升至32.074654 kg m-2、空间P95为39.765626 kg m-2。omega500加权平均为-0.095543091 Pa s-1，支持上升运动背景，但空间分布包含正负值，故维持medium而非上调至high。系统为medium，LLM与系统一致。",
      "key_signals_zh": [
        "daily_precip_total加权平均2.1984986 mm，空间P95 7.9009696 mm",
        "IVT加权平均324.52936 kg m-1 s-1，空间P95 462.58331 kg m-1 s-1",
        "PWAT加权平均32.074654 kg m-2，空间P95 39.765626 kg m-2",
        "omega500加权平均-0.095543091 Pa s-1，存在上升运动背景但空间异质性仍在",
        "相对于24小时，降水、IVT和PWAT同步增强；图谱知识仍未触发"
      ]
    },
    {
      "lead_time_hours": 72,
      "system_base_risk_level": "medium",
      "system_knowledge_triggered": false,
      "system_joint_final_risk_level": "medium",
      "llm_advisory_risk_level": "medium",
      "llm_advisory_confidence": "medium",
      "agreement_with_system": true,
      "advisory_analysis_zh": "LLM判断为medium。daily_precip_total加权平均回落至1.831764 mm，但空间P95仍为6.8408438 mm；IVT加权平均进一步回落至176.72393 kg m-1 s-1，PWAT加权平均为27.386835 kg m-2，仍高于24小时水平。omega500加权平均接近中性，为-0.0097100889 Pa s-1，垂直运动支持减弱；因此综合判断维持medium，不支持升级至high。系统为medium，LLM与系统一致。",
      "key_signals_zh": [
        "daily_precip_total加权平均1.831764 mm，空间P95 6.8408438 mm",
        "IVT加权平均176.72393 kg m-1 s-1，较48小时明显回落",
        "PWAT加权平均27.386835 kg m-2，仍保留湿润背景",
        "omega500加权平均-0.0097100889 Pa s-1，接近中性",
        "相对于48小时，水汽输送和平均降水减弱，但空间降水高值仍存在；图谱知识未触发"
      ]
    }
  ],
  "uncertainty_analysis_zh": "不确定性主要来自空间场的异质性及窗口间信号不同步：48小时的IVT、PWAT和降水共同增强，但omega500包含正负区域；72小时平均输送回落而空间降水高值仍保留。LLM因此在24小时采用medium置信度的low判断，在48和72小时采用medium置信度的medium判断。系统和LLM本案没有分类分歧，但这不等同于预测正确性证明；development指标不能替代独立测试验证。图谱知识未触发，且两类结果均受研究边界约束，不得用于正式预警。",
  "limitations_zh": [
    "数据集为development，不代表独立测试集上的泛化性能。",
    "所有判断仅使用预测时可用的MAZU-like指标、三窗口变化、图谱触发状态和受控方法信息。",
    "未读取同期观测、事件或对照标签、命中、漏报、误报、灾害新闻或事后答案。",
    "该报告不是正式业务预警；系统方法状态为research_candidate，且formal_warning_allowed为false。",
    "图谱知识模式为cross_window_persistence，但本案三个窗口均未触发知识修正，因此无法据此支持额外风险升级。"
  ],
  "recommended_actions_zh": [
    "将48小时窗口作为研究分析重点，继续检查其水汽输送、可降水量和降水空间高值的联合演变。",
    "将24小时low视为直接降水信号不足下的低风险研究判断，将72小时medium视为仍存在空间降水和水汽背景但输送减弱的中等风险判断。",
    "不得将本报告或任一窗口风险等级转换为正式业务预警。",
    "在独立测试集上重新评估方法和LLM意见后，再讨论可操作性边界。"
  ],
  "provenance_summary_zh": "系统预测来自live_neo4j受控查询及预测锁，prediction_lock_sha256为e7e0816f29aa7341bc3f7be279b59b184e9183d17d245e67e31cab08807f615f；联合方法选择锁为8d3526d9f6528378d274129ad424cba39904a5cfcce2e164fc62fe7b4ca55545。数据集划分为development。系统与LLM均未访问真值。",
  "generation_mode": "openai_luna"
}
