{
  "schema_version": "agent_dual_prediction_report_v1",
  "report_mode": "system_plus_llm_advisory",
  "truth_accessed": false,
  "case_id": "20201112_00",
  "region_id": "SA-02",
  "hazard": "heavy_rain",
  "dataset_split": "independent_test",
  "focus_lead_time_hours": 48,
  "selected_joint_rule": "joint_rain_v2_base_kg_persistence_ratio0p25_support1_windows3",
  "development_gate_passed": true,
  "operating_status": "research_candidate",
  "formal_warning_allowed": false,
  "system_focus_risk_level": "low",
  "llm_focus_advisory_risk_level": "low",
  "llm_focus_confidence": "medium",
  "focus_agreement": true,
  "system_analysis_zh": "系统联合预测原样保留：24小时base_method=v2_base，base_risk_level=low，joint_final_risk_level=low，forecast_features.primary_ratio=0.0573950639999999，support_count=1.0，knowledge_mode=cross_window_persistence，knowledge_triggered=false；48小时base_method=v2_base，base_risk_level=low，joint_final_risk_level=low，forecast_features.primary_ratio=0.061015602，support_count=0.0，knowledge_mode=cross_window_persistence，knowledge_triggered=false；72小时base_method=v2_base，base_risk_level=low，joint_final_risk_level=low，forecast_features.primary_ratio=0.0559900579999999，support_count=0.0，knowledge_mode=cross_window_persistence，knowledge_triggered=false。三个窗口的truth_accessed均为false。",
  "llm_advisory_summary_zh": "LLM独立意见：24、48、72小时heavy_rain风险均为low。24小时降水总量加权平均0.1226 mm、空间P95 0.2870 mm，虽IVT空间P95为87.86 kg m-1 s-1，但降水响应弱；48小时降水加权平均升至0.1887 mm、空间P95 0.3051 mm，但IVT空间P95降至48.06 kg m-1 s-1、omega500加权平均为0.00290 Pa s-1，整体不支持风险升级；72小时IVT空间P95回升至92.98 kg m-1 s-1、850 hPa风速加权平均升至6.39 m s-1，500 hPa位势高度加权平均降至5886.84 gpm，但降水空间P95仅0.2800 mm、加权平均0.1865 mm，故仍判为low。",
  "comparison_analysis_zh": "系统联合预测在24、48、72小时均为low，且三窗口均未触发图谱知识规则。LLM独立综合意见也判定三窗口为low，因此焦点风险等级一致。24小时降水量指标整体较低，48小时加权平均降水略升但水汽输送和垂直运动信号减弱，72小时IVT和850 hPa风速回升、500 hPa位势高度下降，但降水空间P95和加权平均仍处于较低水平，未形成足以支持heavy_rain中高风险判断的协同信号。两者的主要差异不在风险等级，而在解释侧重：系统依照锁定的联合规则输出low；LLM额外考虑72小时水汽输送与动力背景回升带来的不确定性，但认为降水量及其空间覆盖不足以改变low判断。",
  "timeline_analysis": [
    {
      "lead_time_hours": 24,
      "system_base_risk_level": "low",
      "system_knowledge_triggered": false,
      "system_joint_final_risk_level": "low",
      "llm_advisory_risk_level": "low",
      "llm_advisory_confidence": "medium",
      "agreement_with_system": true,
      "advisory_analysis_zh": "24小时LLM判断为low。daily_precip_total加权平均0.12255065 mm、空间P95 0.28697532 mm；pwat加权平均25.346614 kg m-2，IVT空间P95 87.855061 kg m-1 s-1，但omega500加权平均0.0045652117 Pa s-1且降水量低，水汽条件未转化为显著降水风险。",
      "key_signals_zh": [
        "daily_precip_total加权平均0.12255065 mm，空间P95 0.28697532 mm，最大值0.81106734 mm。",
        "IVT空间P95 87.855061 kg m-1 s-1，pwat空间P95 38.270788 kg m-2。",
        "omega500加权平均0.0045652117 Pa s-1；系统primary_ratio为0.0573950639999999，support_count为1.0。",
        "系统图谱知识触发状态为false。"
      ]
    },
    {
      "lead_time_hours": 48,
      "system_base_risk_level": "low",
      "system_knowledge_triggered": false,
      "system_joint_final_risk_level": "low",
      "llm_advisory_risk_level": "low",
      "llm_advisory_confidence": "medium",
      "agreement_with_system": true,
      "advisory_analysis_zh": "48小时LLM判断为low。daily_precip_total加权平均升至0.18872385 mm、空间P95为0.30507801 mm，但IVT空间P95降至48.055012 kg m-1 s-1，pwat加权平均降至24.011731 kg m-2，omega500加权平均为0.0028961339 Pa s-1。降水指标虽较24小时略升，水汽输送和动力支持未同步增强，因此不升级风险。",
      "key_signals_zh": [
        "daily_precip_total加权平均0.18872385 mm，空间P95 0.30507801 mm，最大值0.55369115 mm。",
        "IVT空间P95 48.055012 kg m-1 s-1，pwat空间P95 35.363982 kg m-2。",
        "omega500加权平均0.0028961339 Pa s-1，850 hPa风速加权平均3.6689991 m s-1。",
        "系统primary_ratio为0.061015602，support_count为0.0，图谱知识触发状态为false。"
      ]
    },
    {
      "lead_time_hours": 72,
      "system_base_risk_level": "low",
      "system_knowledge_triggered": false,
      "system_joint_final_risk_level": "low",
      "llm_advisory_risk_level": "low",
      "llm_advisory_confidence": "medium",
      "agreement_with_system": true,
      "advisory_analysis_zh": "72小时LLM判断为low，但相较前两窗不确定性略高。IVT空间P95回升至92.975203 kg m-1 s-1、850 hPa风速加权平均升至6.394678 m s-1，500 hPa位势高度加权平均降至5886.8368 gpm，显示水汽输送和动力背景有所增强；然而daily_precip_total加权平均仅0.18650273 mm、空间P95为0.27995029 mm，pwat加权平均为23.429633 kg m-2，降水响应仍弱，故综合风险维持low。",
      "key_signals_zh": [
        "IVT空间P95 92.975203 kg m-1 s-1，最大值113.08208 kg m-1 s-1。",
        "850 hPa风速加权平均6.394678 m s-1，空间P95 10.745646 m s-1；500 hPa位势高度加权平均5886.8368 gpm。",
        "daily_precip_total加权平均0.18650273 mm，空间P95 0.27995029 mm，最大值0.78448439 mm。",
        "omega500加权平均0.020907214 Pa s-1；系统primary_ratio为0.0559900579999999，support_count为0.0，图谱知识触发状态为false。"
      ]
    }
  ],
  "uncertainty_analysis_zh": "不确定性主要来自72小时窗口中IVT、850 hPa风速和500 hPa位势高度呈现较强动力/水汽信号，但降水量、空间P95及pwat未同步支持heavy_rain风险升级；因此LLM对72小时维持low的信心为medium，而非high。24至48小时表现为降水加权平均小幅上升、IVT下降；48至72小时则为IVT和低层风速回升、500 hPa位势高度下降，同时降水指标基本维持低位。系统图谱规则在三个窗口均未触发，LLM未以此推断额外风险。上述判断适用于当前受控预测窗口和研究候选边界，不适用于替代实时观测、局地临近预报或正式预警。",
  "limitations_zh": [
    "本报告仅使用预测阶段可用的受控系统结果、完整MAZU-like指标、三窗口变化、已提供的图谱触发状态和方法边界。",
    "未读取或使用同期观测、事件/对照标签、命中、漏报、误报、灾害新闻或事后答案。",
    "系统与LLM结果均不是正式业务预警；正式预警授权明确为false。",
    "LLM意见是独立研究性综合判断，不替代系统锁定结果，也不改变系统预测。",
    "指标为空间汇总量，不能据此推断具体地点、降水时段或局地极端性。"
  ],
  "recommended_actions_zh": [
    "将系统三窗口low结果与LLM三窗口low意见作为研究候选输出保存，保持两条预测严格分离。",
    "继续关注72小时窗口中IVT、850 hPa风速和500 hPa位势高度的回升或下降趋势，若后续预测同时出现降水量及空间覆盖增强，再重新评估。",
    "不得依据本报告直接发布正式预警；如需业务决策，应另行经过授权流程和实时资料核验。"
  ],
  "provenance_summary_zh": "系统预测来自独立测试集的live_neo4j受控查询，并受prediction lock约束；系统预测锁SHA-256为1ac65855766813b3221697ae67eeb2aa7235d6d488f288e266d611b2814331c6，联合方法选择锁SHA-256为8d3526d9f6528378d274129ad424cba39904a5cfcce2e164fc62fe7b4ca55545。系统选定规则为joint_rain_v2_base_kg_persistence_ratio0p25_support1_windows3。",
  "generation_mode": "openai_luna"
}
